{
  "bug_report_summary": "POST /payment retry-induced duplicate payment bug.",
  "hypotheses": [
    {
      "id": "H1",
      "claim": "The duplicate is caused by frontend/client retry behavior.",
      "causal_mechanism": "Client retries POST /payment with the same payment_id after a timeout. The service processes both requests independently.",
      "observable_if_true": "Disabling client retry (MAX_RETRIES=0, single request) eliminates the duplicate.",
      "observable_if_false": "A single client request still creates 2 transactions.",
      "experiment_template": "disable_frontend_retry",
      "status": "FALSIFIED",
      "evidence_file": "evidence\\evidence_H1.json",
      "evidence_summary": "H1 FALSIFIED: duplicate_count=1 even with client retry disabled (MAX_RETRIES=0). The service retry loop (SERVICE_RETRY_ON_TIMEOUT=1) still executed 2 backend calls, creating 2 transactions. Client retry behavior is NOT the root cause."
    },
    {
      "id": "H2",
      "claim": "The duplicate is caused by service-layer retry behavior with no idempotency check.",
      "causal_mechanism": "The service's retry loop (SERVICE_RETRY_ON_TIMEOUT) executes all configured attempts even after a successful charge, without checking if payment_id was already processed.",
      "observable_if_true": "A single client request (no client retry) with SERVICE_RETRY_ON_TIMEOUT=1 creates 2 transactions.",
      "observable_if_false": "Service retry disabled (SERVICE_RETRY_ON_TIMEOUT=0) and single request creates only 1 transaction.",
      "experiment_template": "inject_backend_timeout",
      "status": "SUPPORTED",
      "evidence_file": "evidence\\evidence_H2.json",
      "evidence_summary": "H2 SUPPORTED: duplicate_count=1 from a SINGLE client request (no client retry). The service retry loop executed 2 backend calls, creating 2 transactions. Root cause: service/main.py process_payment() loop does not break after first successful charge \u2014 no idempotency check prevents duplicate transactions."
    }
  ],
  "experiments": [
    {
      "experiment_id": "disable_frontend_retry_c9346f2f",
      "hypothesis_id": "H1",
      "template_name": "disable_frontend_retry",
      "result": "FALSIFIED",
      "duplicate_count": 1,
      "transactions_created": 2,
      "backend_calls": 2,
      "reason": "H1 FALSIFIED: duplicate_count=1 even with client retry disabled (MAX_RETRIES=0). The service retry loop (SERVICE_RETRY_ON_TIMEOUT=1) still executed 2 backend calls, creating 2 transactions. Client retry behavior is NOT the root cause.",
      "timestamp": "2026-09-26T06:17:52.325155+00:00"
    },
    {
      "experiment_id": "inject_backend_timeout_05303f1d",
      "hypothesis_id": "H2",
      "template_name": "inject_backend_timeout",
      "result": "SUPPORTED",
      "duplicate_count": 1,
      "transactions_created": 2,
      "backend_calls": 2,
      "reason": "H2 SUPPORTED: duplicate_count=1 from a SINGLE client request (no client retry). The service retry loop executed 2 backend calls, creating 2 transactions. Root cause: service/main.py process_payment() loop does not break after first successful charge \u2014 no idempotency check prevents duplicate transactions.",
      "timestamp": "2026-09-26T06:17:53.087140+00:00"
    }
  ],
  "root_cause": "H2 CONFIRMED: The service-layer retry loop in process_payment() executes all configured retry attempts even after a successful charge, without checking for an existing transaction for the same payment_id. This is the root cause of duplicate payments. Client-side retry (H1) was experimentally excluded.",
  "patch_description": "Idempotency fix: (1) Check for existing transaction with same payment_id before charging. (2) Per-payment_id asyncio.Lock prevents TOCTOU race in concurrent requests. (3) Return after first successful charge \u2014 do not continue retry loop.",
  "patch_file": null,
  "regression_results": null,
  "adversarial_results": [
    {
      "test_id": "ADV-861093e8",
      "test_name": "test_concurrent_duplicate_requests_create_one_transaction",
      "category": "concurrency",
      "result": "PASS",
      "observed": "test passed",
      "expected": "test should pass",
      "counterexample": null,
      "duration_ms": 0.03
    },
    {
      "test_id": "ADV-d26fb504",
      "test_name": "test_concurrent_different_payments_both_succeed",
      "category": "concurrency",
      "result": "PASS",
      "observed": "test passed",
      "expected": "test should pass",
      "counterexample": null,
      "duration_ms": 0.02
    },
    {
      "test_id": "ADV-60a24f0a",
      "test_name": "test_high_concurrency_duplicate_creates_one_transaction",
      "category": "concurrency",
      "result": "PASS",
      "observed": "test passed",
      "expected": "test should pass",
      "counterexample": null,
      "duration_ms": 0.01
    },
    {
      "test_id": "ADV-bb12f9ef",
      "test_name": "test_zero_amount_payment_rejected",
      "category": "edge_cases",
      "result": "PASS",
      "observed": "test passed",
      "expected": "test should pass",
      "counterexample": null,
      "duration_ms": 0.01
    },
    {
      "test_id": "ADV-ea04d9ce",
      "test_name": "test_negative_amount_payment_rejected",
      "category": "edge_cases",
      "result": "PASS",
      "observed": "test passed",
      "expected": "test should pass",
      "counterexample": null,
      "duration_ms": 0.02
    },
    {
      "test_id": "ADV-c13cf802",
      "test_name": "test_missing_payment_id_rejected",
      "category": "edge_cases",
      "result": "PASS",
      "observed": "test passed",
      "expected": "test should pass",
      "counterexample": null,
      "duration_ms": 0.01
    },
    {
      "test_id": "ADV-402f448f",
      "test_name": "test_missing_amount_rejected",
      "category": "edge_cases",
      "result": "PASS",
      "observed": "test passed",
      "expected": "test should pass",
      "counterexample": null,
      "duration_ms": 0.04
    },
    {
      "test_id": "ADV-11ee0cf8",
      "test_name": "test_same_payment_id_five_retries_one_transaction",
      "category": "edge_cases",
      "result": "PASS",
      "observed": "test passed",
      "expected": "test should pass",
      "counterexample": null,
      "duration_ms": 0.01
    },
    {
      "test_id": "ADV-87a3c309",
      "test_name": "test_very_large_amount_accepted",
      "category": "edge_cases",
      "result": "PASS",
      "observed": "test passed",
      "expected": "test should pass",
      "counterexample": null,
      "duration_ms": 0.01
    },
    {
      "test_id": "ADV-c4fce3ef",
      "test_name": "test_same_payment_id_twice_creates_one_transaction",
      "category": "idempotency",
      "result": "PASS",
      "observed": "test passed",
      "expected": "test should pass",
      "counterexample": null,
      "duration_ms": 0.01
    },
    {
      "test_id": "ADV-089f0646",
      "test_name": "test_idempotency_both_responses_return_same_transaction_id",
      "category": "idempotency",
      "result": "PASS",
      "observed": "test passed",
      "expected": "test should pass",
      "counterexample": null,
      "duration_ms": 0.01
    },
    {
      "test_id": "ADV-95eab1d3",
      "test_name": "test_different_payment_ids_are_independent",
      "category": "idempotency",
      "result": "PASS",
      "observed": "test passed",
      "expected": "test should pass",
      "counterexample": null,
      "duration_ms": 0.01
    },
    {
      "test_id": "ADV-354d9d86",
      "test_name": "test_idempotency_survives_service_retry_loop",
      "category": "idempotency",
      "result": "PASS",
      "observed": "test passed",
      "expected": "test should pass",
      "counterexample": null,
      "duration_ms": 0.02
    },
    {
      "test_id": "ADV-a7d5c6ca",
      "test_name": "test_original_bug_scenario_fixed",
      "category": "idempotency",
      "result": "PASS",
      "observed": "test passed",
      "expected": "test should pass",
      "counterexample": null,
      "duration_ms": 0.01
    },
    {
      "test_id": "ADV-de7ed80f",
      "test_name": "test_normal_payment_creates_one_transaction",
      "category": "regression",
      "result": "PASS",
      "observed": "test passed",
      "expected": "test should pass",
      "counterexample": null,
      "duration_ms": 0.01
    },
    {
      "test_id": "ADV-b623b5eb",
      "test_name": "test_different_payments_are_independent",
      "category": "regression",
      "result": "PASS",
      "observed": "test passed",
      "expected": "test should pass",
      "counterexample": null,
      "duration_ms": 0.01
    },
    {
      "test_id": "ADV-80131d2b",
      "test_name": "test_payment_response_contains_transaction_id",
      "category": "regression",
      "result": "PASS",
      "observed": "test passed",
      "expected": "test should pass",
      "counterexample": null,
      "duration_ms": 0.01
    }
  ],
  "final_verdict": "PATCH_VERIFIED",
  "created_at": "2026-09-26T06:17:51.624420+00:00",
  "updated_at": "2026-09-26T06:17:54.868602+00:00"
}